Filename,Date taken,Coordinates taken,Camera used,Description,
Bonstetten_1.jpg,2024-08-11T12:08:11.469Z,47.33697/8.46008,Pixel 3a main Camera,Bonstetten from the pedestrian bridge over the highway a bit north of the border of the municipality.,Personally identifiable information removed using black shapes.
Bonstetten_2.jpg,2024-08-11T12:16:55.811Z,47.33085/8.46272,Pixel 3a main Camera,Bonstetten from the north just south of the golf club Albis-Golf.,
Bonstetten_3.jpg,2024-08-11T12:37:13.803Z,47.32632/8.45291,Pixel 3a main Camera,Bonstetten from the north-west on the Lüttenbergstrasse.,
View_Chaeseren.jpg,2024-08-11T13:14:02.239Z,47.32599/8.44844,Pixel 3a main Camera,"The view from above the farm Chäseren towards the east with lake Zürich and alps in St. Gallen, Appenzell and Glarus.",
Bonstetten_4.jpg,2024-08-11T13:43:42.180Z,47.31842/8.45392,Pixel 3a main Camera,Bonstetten from the west-north-west.,
