Filename,Date taken,Coordinates taken,Camera used,Description
Kleiner_Hebelstein_view.jpg,2024-05-20T11:19:36.229Z,47.55685/8.59005,Pixel 3a main Camera,View from the kleiner Hebelstein towards the north.
Oberer_Tannenplatz_fireplace.jpg,2024-05-20T11:34:45.146Z,47.55996/8.58155,Pixel 3a main Camera,Fireplace near Tannenplatz.
Irchel_Hochwacht_view.jpg,2024-05-20T13:01:29.874Z,47.55778/8.57951,Pixel 3a main Camera,View from Irchel Hochwacht towards the north-west towards Buchberg and Eglisau.
Berg_am_Irchel_1.jpg,2024-05-20T13:20:50.419Z,47.56412/8.58227,Pixel 3a main Camera,Berg am Irchel from the south-west near Rossweg.
Pistolenstand_fireplace.jpg,2024-05-20T13:41:08.165Z,47.56132/8.58911,Pixel 3a main Camera,Fireplace and Shelter at Pistolenstand.
Berg_am_Irchel_2.jpg,2024-05-20T13:44:19.532Z,47.56151/8.59024,Pixel 3a main Camera,Berg am Irchel from the water reservoir in the south-west.
